<?xml version="1.0" encoding="UTF-8"?>
<!DOCTYPE eventslinks SYSTEM "eventslinks.dtd">
<eventslinks>
	<event number="0">
		<eventType>SejourMCO</eventType>
		<predicate>
			<numeric>
				<predicateType>hasMedecin</predicateType>
				<minValue>10</minValue>
				<maxValue>20</maxValue>
			</numeric>
		</predicate>
		<predicate>
			<factor>
				<predicateType>hasDP</predicateType>
				<value>15115457</value>
				<value>45656244</value>
				<value>1</value>
				<value>2</value>
				<value>pellegrin</value>
			</factor>
		</predicate>	
	</event>
		<event number="1">
		<eventType>SejourMCO</eventType>
		<predicate>
			<numeric>
				<predicateType>hasMedecin</predicateType>
				<minValue>10</minValue>
				<maxValue>20</maxValue>
			</numeric>
		</predicate>	
	</event>
	<link>
		<event1>1</event1>
		<event2>0</event2>
		<predicate1>hasBeginning</predicate1>
		<predicate2>hasMedecin</predicate2>
		<operator>diff</operator>
		<minValue>1</minValue>
		<maxValue>10</maxValue>
	</link>
</eventslinks>
