<?xml version="1.0" encoding="UTF-8"?>
<!DOCTYPE eventslinks SYSTEM "eventslinks.dtd">
<eventslinks>
	<event number="0">
		<eventType>SejourMCO</eventType>	
		<predicate>
			<factor>
					<predicateType>inEtab</predicateType>
					<value>330000555</value>
					<value>330000217</value>
			</factor>
		</predicate>
	</event>
		<event number="1">
		<eventType>SejourSSR</eventType>
		
	</event>
		<link>
		<event1>0</event1>
		<event2>1</event2>
		<predicate1>hasEnd</predicate1>
		<predicate2>hasBeginning</predicate2>
		<operator>diff</operator>
		<minValue>1</minValue>
		<maxValue>3</maxValue>
	</link>
</eventslinks>
